{
  "argv": [
    "python3",
    "-m",
    "doctest",
    "-v",
    "fixture/textutil.py"
  ],
  "capture_timestamp": "2023-11-14T22:13:20+00:00",
  "case_id": "python-doctest-pass",
  "checked_out_commit_sha": "21e998bd125eb85d3e9e514b6ac0529816081a42",
  "cwd": ".",
  "environment_allowlist": [
    "PATH"
  ],
  "exit_code": 0,
  "flake_lock_sha256": "75708d790dd63c3aac0723c2a5349987ce64a7df6214023bae7afce49afec3d0",
  "locale": "C.UTF-8",
  "nix_system": "x86_64-linux",
  "nix_version": "2.28.5",
  "nixpkgs_revision": "ac62194c3917d5f474c1a844b6fd6da2db95077d",
  "phase": "native",
  "qodec_tree_sha": null,
  "receipt_version": "corpus-receipt-v1",
  "repository_head_sha": "21e998bd125eb85d3e9e514b6ac0529816081a42",
  "stderr_sha256": "e3b0c44298fc1c149afbf4c8996fb92427ae41e4649b934ca495991b7852b855",
  "stdin_sha256": null,
  "stdout_sha256": "31227afdf619a3e31591683b783505aec903d8794f3ab77212c5438ca6caa113",
  "timeout_status": "ok",
  "timezone": "UTC",
  "tool_binary_sha256": "34e0e5e1a829a1e7a7f7b0db15a786b543602b53354da82e3cea56951f619de3",
  "tool_identity": "python3",
  "wall_time_s": 0.05618
}
